{
  "schemaVersion": "1.0.0",
  "id": "home",
  "type": "screen",
  "name": "Home",
  "frame": {
    "x": 0,
    "y": 0,
    "w": 480,
    "h": 320
  },
  "props": {},
  "style": {
    "main": {
      "default": {
        "bg_color": "#102a43ff",
        "bg_opacity": 255,
        "text_opacity": 255,
        "border_opacity": 255,
        "shadow_opacity": 255,
        "outline_opacity": 255,
        "bg_img_opacity": 255,
        "text_font": "@SourceHanSansCN-Bold",
        "text_font_size": 16
      }
    }
  },
  "events": [],
  "children": [
    {
      "type": "label",
      "id": "lbl_title",
      "name": "Title",
      "frame": {
        "x": 24,
        "y": 24,
        "w": 240,
        "h": 40
      },
      "props": {
        "text": "Hello ForgeUI",
        "is_text_static": false,
        "long_mode": "WRAP"
      },
      "style": {
        "main": {
          "default": {
            "text_font": "@SourceHanSansCN-Bold",
            "text_font_size": 16,
            "bg_opacity": 0,
            "text_opacity": 255,
            "border_opacity": 255,
            "shadow_opacity": 255,
            "outline_opacity": 255,
            "bg_img_opacity": 255,
            "bg_color": "#ffffff00",
            "text_color": "#F0F4F8ff",
            "text_align": "left"
          }
        }
      },
      "events": [],
      "children": []
    },
    {
      "type": "button",
      "id": "btn_next",
      "name": "Next",
      "frame": {
        "x": 180,
        "y": 240,
        "w": 120,
        "h": 48
      },
      "props": {
        "text": "Next",
        "long_mode": "WRAP"
      },
      "style": {
        "main": {
          "default": {
            "text_font": "@SourceHanSansCN-Bold",
            "text_font_size": 16,
            "bg_opacity": 255,
            "text_opacity": 255,
            "border_opacity": 255,
            "shadow_opacity": 255,
            "outline_opacity": 255,
            "bg_img_opacity": 255,
            "bg_color": "#2196F3ff",
            "text_color": "#ffffffff",
            "radius": 8,
            "text_align": "center"
          }
        }
      },
      "events": [
        {
          "id": "evt_btn_next_click",
          "trigger": "CLICKED",
          "actions": [
            {
              "type": "CHANGE_SCREEN",
              "target": "settings",
              "anim": "none",
              "ms": 0
            },
            {
              "type": "CALL_FUNCTION",
              "handler": "on_btn_next"
            }
          ]
        }
      ],
      "children": []
    }
  ]
}
